textID,text,selected_text,sentiment
cf9cdcdf32, well that does make me feel better about staying up even later to watch the daily show.   lay on the guilt again.,well that does make me feel better about staying up even later to watch the daily show.   lay on the guilt agai,neutral
b605bcf6ec,is working.   I am so happy my job is a radio and not anything physically exhausting....,o happy,positive
c9e1d5cf0b,wishes it wasn`t a bank holiday so he could be on the radio this afternoon... but at least he has another week to come up with some ideas,wishes it wasn`t a bank holiday so he could be on the radio this afternoon... but at least he has another week to come up with some ideas,neutral
9fedf57dce," episode 17 season 1, i love chuck bass.  who`s going to the short stack filming next sat? Im making a flag. ;D",", i love",positive
1d8f130239,"  Guys, nothing is free in life. Where is my shidduch money?","Guys, nothing is free in life. Where is my shidduch money?",neutral
b1452fcceb,ive spent a lazy day today finding some interesting people to follow  its reinforced the saying... it takes all sorts of people ...,ive spent a lazy day today finding some interesting people to follow  its reinforced the saying... it takes all sorts of people ...,neutral
01d66b7d46, yeah the weather ruined my plans too  i was gonna beach it up as well,ruined,negative
bc63da3379,My apologies for the very impersonal #FF. Swamped today  All great people and great follows though. You can`t go wrong with those folks!,My apologies for the very impersonal #FF. Swamped today  All great people and great follows though. You can`t go wrong with those folks!,neutral
1ef4f2723c," belay the swimsuit, hot tub won`t be ready this weekend.  sadness",sadness,negative
02e33eaea2,we are looking forward to daddy returning from work on Saturday. He`s been gone a whole month,we are looking forward to daddy returning from work on Saturday.,positive
36ff6aaafd,heading to work,heading to work,neutral
a330318e28,"_shantz heyy shantell!  twitter is cool, thats why! and guess what!! i followed britney spears, and she followed me back!","cool,",positive
34e4370330, College cops: they get suspicious when they see more than one person in a group together.,College cops: they get suspicious when they see more than one person in a group together.,neutral
132f15a855,Hey hey get tickets to ALL TIME LOW when they`re in Aussie kay. www.myspace.com/destroyalllines Yup. Go there get tickets,Hey hey get tickets to ALL TIME LOW when they`re in Aussie kay. www.myspace.com/destroyalllines Yup. Go there get tickets,neutral
bcabb3d212,http://tr.im/kXCL `Immigrant hid passport in pants` What a genius.,What a genius.,positive
344467bdaf, ay buti pa kayo!!!! uy thank you!!,y thank you!!,positive
0a0a3310ca,And I just saw something real sad on my lunch... A dog with two broken back legs.,sad,negative
c68863089e,_tifullyTragic ... in London last night so give it a few hours & I`m sure a few will appear,in London last night so give it a few hours & I`m sure a few will appear,neutral
e03324c33b,i lost a follower,lost a follower,negative
e570711aaa,its almost lunch time for you,its almost lunch time for you,neutral
b4a2ca6400, heard of. And you`re the first to mention him to me!,heard of. And you`re the first to mention him to me!,neutral
f14f087215, i dont think you can vote anymore! i tried,i dont think you can vote anymore!,negative
ad4668fb0e," Lol. Thanks, Penny. I`m trying to believe you.","Thanks,",positive
7e15438cc8,"today is maintenance day for me, my flat and my blog...yeahhhh a lot of little works","today is maintenance day for me, my flat and my blog...yeahhhh a lot of little works",neutral
7f20b3874a,Making a birthday song to a special person!!,Making a birthday song to a special person!!,neutral
46a80e9366,I wish I could go back to bed with ,wish,positive
d5048db173,Worried about the reply after sending THE SMS to 78277.,Worried,negative
bd5405bb27,...And omg whats this dirty letter from Danny everyones been on about? Its absolutely none of my business but I still feel left out lol,feel left out lo,negative
ee2f57d95a,Feeling much better  Doing History Research.,Feeling much better  Doing History Research.,positive
662510c8de,Off to prom. Say hi to me,Off to prom. Say hi to me,neutral
c489f325a3,Just paid my bills now I have no money,Just paid my bills now I have no money,negative
05bc0dfa8e," unfort, i can`t DM you b/c ur not following me","unfort, i can`t DM you b/c ur not following me",neutral
3db4ec8f52," I know, I stink at birthdays  sorry bra, hope you`re having fun anyhow, in spite of me!","I know, I stink at birthdays  sorry bra, hope you`re having fun anyhow, in spite of me!",neutral
4d22ec80fd, Thanks hon!! Project Bra starts today!,Thanks,positive
a015a43be1,Okay so I`m trying to be happy and deal with my problems and my friends` also. Its hard,Its hard,negative
14cfb35236,"i feel extra-nauseous all of a sudden, like my stomach wasn`t ready to resume peristalsis after the events of two nights prior","i feel extra-nauseous all of a sudden,",negative
10133a7283," He died.  Wait, what about Magic Jack? I just read it.","He died.  Wait, what about Magic Jack? I just read it.",neutral
da59221e53," Toooooom! Do a tour in the Philippines, pleeease?  I`m risking my health to get your reply. Haha!",`m risking,negative
ce6ba16d69,**** elora danan are breaking up  too and im missing their last nsw show too  def need to hit up melbs !! someone come with ?,**** elora danan are breaking up  too and im missing their last nsw show too  def need to hit up melbs !! someone come with,negative
b2bea50fa1,": Yeah, I fell asleep  I`m sorry. No way in the world I was waking up @ 7am lol. I had to work @ 9am.",I`m sorry.,negative
a77c6a697c, My sister is graduating too & I can`t afford to buy here anything,& I can`t afford to buy here anything,negative
9afda201ce, what do you mean jorx?,what do you mean jorx?,neutral
3ad3cbb843, very familiar.....sorry you`re feeling that way,.sorry,negative
eacb4cf861,"worked out tonight, had to work off the Cheesecake I ate todAY. To all the pple who are on a diet.. DON`T QUIT! It`s not worth it","worked out tonight, had to work off the Cheesecake I ate todAY. To all the pple who are on a diet.. DON`T QUIT! It`s not worth it",neutral
3e08ed0b7b,"I can`t have any pets in the appartment I really want, so no rat yet.",I can`t have any pets in the appartment I,negative
33e19d25f3,why does my body decide NOW is a good time to wake up every morning at 8?! Maybe Dean will wait for me in my dreams...,good,positive
d1a3de2cf6," have a great night, it was so nice meeting you last night! You are a sweetheart!  xoxoxo bye for now.",great,positive
92ca5583bf,Off to England during the summer holidays this year.... yay!,yay!,positive
5d51da4bac," Don`t worry, you spelt `NO` correctly! It just looks wrong","Don`t worry, you spelt `NO` correctly! It just looks wrong",neutral
0157208f9a, haha kk tell me when u remember,haha kk tell me when u remember,neutral
fb45b19ca3, hahah I`ll try,hahah I`ll try,neutral
3578ec042e, haha calm down. Youll get ur shades. I`m still sick tho. So I`ll prolly knockout after,sick,negative
12c28b4d30,wheelchair fitting today for mall buzzing & Home Depot. 'Homebound' just got REAL old  Goal: taxi yellow or electric RED!,wheelchair fitting today for mall buzzing & Home Depot. 'Homebound' just got REAL old  Goal: taxi yellow or electric RED!,neutral
6b3c07bec3,is back from a weekend get away,is back from a weekend get away,neutral
47f459b637,happy mother`s day! everyone have a great day and make sure you go see ya mommas,great day,positive
dbd5568fa7,is at cindy babys house......taking in these last fridays we have together  DR!!! i hope,i hope,positive
9465fee9cd,  ive got a cold too... It sucks  and u were awesome in ipswitch xD,ive got a cold too... It sucks  and u were awesome in ipswitch xD,neutral
3263423ce3, thanx 4 thee follow,thanx,positive
7e15cc078e, ah helping my friend move and will defo be having a well deserved pint after it that`s for sure,well deserved,positive
fe66579fd8," Thanks dear, I know this, but I appreciate the validation as always",Thanks,positive
21ec4c00cb, thanks! I will try #boarding out,thanks! I will try #boarding out,neutral
1bb7a4f6c3,Laying with lyndi on drive way. Drinking tea. Listenin to music. Takin pictures. Just a Chillin.,Just a Chillin.,positive
4b4a16b029,"Finally back in bed with my puppies after a LONG week in Jamaica. loved it, but lve to be home too!! Night",loved,positive
b19b0e9a54,finally seventeen,finally seventeen,neutral
369f2d32ea, it`s definitely worth it; art not withstanding  I hate moving; and hate packing even more..,I hate moving; and hate packing even more,negative
9654a9b0b9, Awww  You`ll Be Fine...,e Fine,positive
fbc22efc4d, that sucks.,sucks.,negative
7dc450fe0c,Oh no... that bird is back,Oh no... that bird is back,negative
11f48ef97d,an aston os my dream car but its wishful thinking,an aston os my dream car but its wishful thinking,neutral
9bf2e0669e,_fisher Hey!! How are u??did u got my reply??,_fisher Hey!! How are u??did u got my reply??,neutral
648d2179d6, thanks for sharing,thanks,positive
fcd2db766a, My lil` old Mac did the same thing...and it was never to charge again.,it was never to charge again.,negative
768801365c, agreed,agreed,neutral
8b7c0322a2, aww  that`s horrible! xD,s horrible,negative
e860bdc5ef,Dancing was alright todayy still doing Jai Ho!!,Dancing was alright to,positive
7ec8b0877d, thx girl! I just now woke up! I cnt believe I`m sick!! Now I have a fever... Wish I could pound nyquil  This sucks.,This sucks.,negative
9cc5a9f2c1,"white pointy shoes haha, and ah you got me excited about the new drummer  youre mean","white pointy shoes haha, and ah you got me excited about the new drummer  youre mean",neutral
3a33697bb7, dad`s been having fever since last nite and needs 2 bottles of blood trasfusion..loaded 1 today..1 to go tomorrow.,having fever,negative
b32e53af9e,I think I love a part of me saying some cynical words. Even though I smile when I say them. Do you think it`s bad?,love,positive
7f0eab1127,Date movie with Nate. Most likely Wolverine.,Date movie with Nate. Most likely Wolverine.,neutral
ee257f56bd,"Yes! Cold coffee from yesterday. No sugar, no cream !  The way I like it !","Yes! Cold coffee from yesterday. No sugar, no cream !  The way I like it !",positive
f13a09937c,Blogging-- http://13tolife.us/ Mentioning links to contests where you might just win a free book or two!,Blogging-- http://13tolife.us/ Mentioning links to contests where you might just win a free book or two!,neutral
e8f198f149,"feeling lonely,DH on night shift all w/e","lonely,D",negative
7a36fca205," it`s an awesome book, can`t wait for the film - enjoy and don`t be scared  x",enjoy,positive
b44f09c005,I`m still pumped from the concert saturday. 17/7/09 here i come,pumped,negative
fcfa10681f,first day of summer sucks!!!! its overcast and cold...  this isn`t summer!?!?!?!?,sucks!!,negative
496a81c5fc,listening to some brandy...never say never cd,listening to some brandy...never say never cd,neutral
514e9ebe67," been there, done that","been there, done that",neutral
a86a8ad3e4,bed rest for all weekend and next week  neomonia suck,neomonia suck,negative
74552afd3c,im really tired.. not much time to sleep,tired..,negative
a0577b9f07,Hates being sat around alone on a Friday night. big sad old loser,big sad old loser,negative
fb150a1d7c,good topics. and ciggarettes.,good topics.,positive
60aceb4db0,may the fourth be with you  happy star wars day.,happy,positive
f5f6d20514,such.a.tease.,such.a.tease.,neutral
63fbc4be7a,home in carlsbad with the whole family for mother`s day!,home in carlsbad with the whole family for mother`s day!,neutral
662a988688, but lorraine kelly is a sexy mama!,lorraine kelly is a sexy mama!,positive
7c1d73feef, And U are doing Brilliantly sweetie!!!   Blessings and Joy to you!!!,Blessings and Jo,positive
4b56be7528,i`m bored : hope your wlan will go today!,i`m bored :,negative
0414afb09b,  boo. I used to live in upland... Have funnnn,e funnnn,positive
2192d9c8ec," cheers mate, still getting over Wednesday  You ok? You should be, you are an incredibly wealthy man",", you are an incredibly wealthy man",positive
2614f7b5de, awww sowy shortie,sowy,negative
7d2f8e5e7a,Had a blood test today.   Wasn`t too bad really. Needed to dash 2 Starbucks after to revive my spirits with a nice Iced latte & a bun.Yum!,Had a blood test today.   Wasn`t too bad really. Needed to dash 2 Starbucks after to revive my spirits with a nice Iced latte & a bun.Yum!,positive
f3b213a94c,third driving lesson then back to the office,third driving lesson then back to the office,neutral
1d6411e9dd,"failed inspection. Did you know you can pass wo/oven, but not wo/anti-tip bracket, which is only sold w/oven? This is worse than taxes.",This is worse than taxes.,negative
511521855b,has such a freakin migraine,has such a freakin migraine,negative
8ddd7b906d,closeness or distance? closeness... but now everything seems so distant...,closeness or distance? closeness... but now everything seems so distant...,neutral
f54b97937a," aww lovely! Hope you had a great mother`s day, our little mother hen  did you get in contact with sharn?",aww lovely!,positive
c2b3f9d6cf, A new baby? How exciting  Congrats in advance,exciting,positive
4838235f8a," I agree - they will start - and I forgot, all that news is HT ","I agree - they will start - and I forgot, all that news is HT",neutral
68103f1782, gray! .... i so feel neglected,i so feel neglected,negative
d921c7e00e," Heh, aye. I should have investigated properly first before asking  Does seem like it`s not the most obvious thing though.",e it`s not the most obvious thing though,negative
e65b2f93f2,is snuggled in bed reading,snuggled,positive
de7c86634c, like almost above my sholders,like almost above my sholders,neutral
fc8b4e690e,Damnit Day 26 is at Northpark mall..I use to live near there  someone steal Mike for meeee!,steal,negative
229e1200b7,Bella doesn`t love me no more,doesn`t love me no more,negative
23519c6777, I`m not feeling very inspired today...I was suppose to be @ the B`ham concert tonight!,I`m not feeling very inspired today..,negative
87e7c38d7c,  What`s wrong with her?,s wrong,negative
2f6d9d1419,  #stackeoverflow  http://bit.ly/13Nfk1,#stackeoverflow,neutral
05bdfb2daf, I wish they replied to us. July will be utterly amazing!,July will be utterly amazing!,positive
2b7ae450f4,: i really adore your K-POPPED site ! http://k-popped.com/ haha,really adore,positive
8a2abadce0,oh my. i have to play cluedo.,oh my. i have to play cluedo.,neutral
c86e02d3d0,"Watching Rugrats  anndd Tweeting, of course!","Watching Rugrats  anndd Tweeting, of course!",neutral
f75ab644ab,i`m lonely.  i need some hug.,i`m lonely.  i need some hug.,negative
712d82ecb6, nuthin much just gettin ready 2 head bk 2 wrk  n u???,nuthin much just gettin ready 2 head bk 2 wrk  n u???,neutral
26862f97c8,"Makes sense that greatfirewallofchina.org, a site to test whether a site is blocked in China, is blocked in China. Get that?  Any others?","Makes sense that greatfirewallofchina.org, a site to test whether a site is blocked in China, is blocked in China. Get that?  Any others?",neutral
8080dbb71a,save me--i feel like i`m going crazy.  ? http://blip.fm/~5z193,i feel like i`m going crazy.,negative
baaa649aaa, very impressed,very impressed,positive
1c749523ed, I wanna watch that movie again. Maybe that dvd will work in my laptop since Dawson`s Creek doesn`t,I wanna watch that movie again. Maybe that dvd will work in my laptop since Dawson`s Creek doesn`t,neutral
a0d19c232b," dbl booooooo for being sick, flippin blows! ... bahaha i kno i dont have many friends on here either. i feel so lame  haha",i feel so lame,negative
af7b184860,Does anyone know how to scale a pic down I`m trying to change my pic but all my pics r 2 big n I keep cropping them...HELP,HELP,negative
7a5e9f29a4, i graduate at 9am on Sunday June 14th...,i graduate at 9am on Sunday June 14th...,neutral
8e9bcd2873, can we please?,can we please?,positive
03d0197f74,Just got off phone with Black Swamp Bird Observatory - No reports of Connecticut Warbler from Metzger or Magee today...,Just got off phone with Black Swamp Bird Observatory - No reports of Connecticut Warbler from Metzger or Magee today...,neutral
46bd376e77,Is anyone else having problems following and unfollowing peeps? For me this has gone on for over a week!,problems,negative
92e1b6846e, We saw that in none 3D - the baddie`s the best,best,positive
1a62205df0,"I`d respond, if I were going","I`d respond, if I were going",neutral
585789af1f,I`m surrounded by negativity good thing there is a Fly Guy to give me hope that there is something better  thank u Jesus,I`m surrounded by negativity good thing there is a Fly Guy to give me hope that there is something better  thank u Jesus,neutral
c3bb37493e,"http://twitpic.com/4jerc view of Atlas Mountains, Morocco across the Straits of Gibraltar, I took the other day from Europa Point, Gib","http://twitpic.com/4jerc view of Atlas Mountains, Morocco across the Straits of Gibraltar, I took the other day from Europa Point, Gib",neutral
de06f9c2f3," No, it`s annoying and makes us girls that follow sports and are knowledgable look dumb","No, it`s annoying and makes us girls that follow sports and are knowledgable look dumb",negative
7ba102ebb3, I`m glad  you def needed a pick me up!  drama free!,glad,positive
bc49371473," Ohhh, he is very regal man-cat! But he is blocked",blocked,negative
3e9e3f0d69," nah, you`re just altered forever   Enjoy.",you`re just altered forever   Enjoy,positive
72bafdda6a, I was born there,I was born there,neutral
2deb9b910d," Masson I`ll give you the link, it`s quite handy",handy,positive
1d779830cc,Y is it when I luv someone I fear them? i just wish someone can exsplain it 2 me,Y is it when I luv someone I fear them?,neutral
d4fe653622,http://twitpic.com/4jjy9 -  This morning view from my back deck,This morning view from my back deck,neutral
0c141903c8,working until10,working until10,neutral
7b8fcb4aac,IT DIDN`T WORK,IT DIDN`T WORK,negative
d2a7a3c6aa, You and your Yuotube links.  DENIED at work.,DENIED at work,negative
8d8b74824d,No one is at the tesla dealership,No one is at the tesla dealership,neutral
3dec28069e, i know  but the weather`s clearing and suppose to be nice sat and sun,d suppose to be nice,positive
74c70e8289,I may have to take a trip in to the loft to get the fans down...its like being in spain!! Except without a pool to cool down in  xxxxxxxx,I may have to take a trip in to the loft to get the fans down...its like being in spain!! Except without a pool to cool down in  xxxxxxxx,neutral
11639b3048," Praying for love in a lap dance, and paying in naivety. <--One of my fav songs",my fav,positive
ccd759ac68,  http://twurl.nl/goljwp is what i get when i try to add a new post,http://twurl.nl/goljwp is what i get when i try to add a new post,neutral
7fb4bbba70,http://twitpic.com/67fcj - what i have to resort to wearing today cause i haven`t finished my laundry. lol.,my laundry. lol.,positive
6fabbd3049,everyone vote for  for the mtv movie awards coz my comp is mashed up and wont let me vote!  i will somehow!!!!!!,mashed up,negative
3d03953cdb, I know right...,I know right...,neutral
4900e9dc87, i know. But.,i know. But.,neutral
0842f5fa34,did it!!  back in pakistan! - http://bkite.com/07kBQ,did it!!  back in pakistan! - http://bkite.com/07kBQ,neutral
931add5d49,Follow _joe he`s cool,cool,positive
003d9dfe41,just woke up...feelin a lil better  <3,better,positive
df1f980d8e," take it. mmm, definitely.","take it. mmm, definitely.",neutral
71fa625813,Listening to Broken by Lifehouse (on repeat),Listening to Broken by Lifehouse (on repeat),neutral
ce8ad9a73d,i can`t wait till tomorrow. just because its a new day,i can`t wait till tomorrow. just because its a new day,neutral
acd7baeab3," why arent u famous already? lol you have a very adoring fan, that fan would do anything for you hehehe, im you no.1 fan","very adoring fan,",positive
35cc728e1d, I hate that Costco always costs us so much money,I hate that Costco always costs us so much money,negative
f4f0b3fbe1,ughh feel rubbish,ughh feel rubbish,negative
c6bf3b9d02, ooo enjoy  and thanks for looking out for ours,d thanks,positive
4737fe0beb,has the greatest friends in the entire world,greatest,positive
d5e6ee0171,"_hong  Oh yeah, just came back from a weekend of cosplay photo marathons","_hong  Oh yeah, just came back from a weekend of cosplay photo marathons",neutral
66adab7336,watching freo on a sunday arvo is a good hobby,good hobby,positive
5443f941b5,missed Britains got talent    gutted.,missed,negative
ee109b3e82,(bye) plurk out muna. will be back when im done reading the book  http://plurk.com/p/rq9c7,(bye) plurk out muna. will be back when im done reading the book,neutral
aed14b7ec2,"Feeling better today, but still sick.","Feeling better today, but still sick.",neutral
03445b5ba3,My wife can`t get on the guest list for tomorrows show because it doesn`t exist. LAME. I guess no wife at the show.,LAME.,negative
872173e15e,aww  you are too kind!! Hi sweetie! Are you guys out partying without me   I`m the only person who came to work 2nite lol,aww  you are too kind!! Hi sweetie! Are you guys out partying without me   I`m the only person who came to work 2nite lo,positive
366b5ae639,i am going to be staring at hello kitty`s face at 3-9,i am going to be staring at hello kitty`s face at 3-9,neutral
5f40b0f0d6,_Claire its sunny here  I will send some over to you,_Claire its sunny here  I will send some over to you,neutral
61c3c68a34,This is fun !  haha re guy from all American rejects looks like he`s on crack!!,This is fun,positive
a0356ac920,Can`t sleep and nothings on tv!!,Can`t sleep,negative
98cb7c67de,ahh..my stomach hurts,my stomach hurts,negative
61fc125f6c," Im 20 - believe me, I`ve tried! I`m just too ginger! Freckles join up on my face - that`s it!  get it out a bottle cancer ...",Freckles,negative
ea188a7701,At the park!  Its raining!,At the park!  Its raining!,neutral
1c779efb57,_of_the_dead I met a stranger just 10 min ago. He was stalking me at the store,_of_the_dead I met a stranger just 10 min ago. He was stalking me at the store,neutral
cd8deca773,Walmart opening its first store in Amritsar tomorrow (of all places)...the horror..hoping its limited to wholesale,hoping it,positive
30b8f1abed,that was an interesting show to say the least. recap tomorrow. first i must sleep. work in am.,that was an interesting show,positive
67a06b149b,Hmmm.... My whole body feels sore!,sore!,negative
b55e8b3e2e, I`m having the same problem,problem,negative
60a29b5dd0, I`m pretty sure my bum shape will still be imprinted there,I`m pretty sure,positive
14f76fadf5,I can`t I`m on my iPhone,I can`t I`m on my iPhone,neutral
d670e74865,- had a great time at the `block party` - so did mackenzie,great,positive
5d31b01820,So cold in here!  getting the chill,So cold in here!  getting the chill,negative
ad95cc6f43,happy mother`s day everyone,happy,positive
1e8a00169a,"gotta buy the second season of  ghost whisperer now, but noo moneyy",but noo moneyy,negative
7f63c04f61,GIVE A HATER A Hug ? Why would you do that? I don`t like mwean people,I don`t like,negative
78216a713a,"I have to admit, I`m a bit bummed out that I wasn`t with my friends walking today....",bummed,negative
85a656ef9f,will be doing all the chores just for her mama,will be doing all the chores just for her mama,neutral
24d4fa8e2b,I wanna roc wit`chu . Imy buu,wanna roc wit`chu,positive
b1b4355d45, THAT`S A SHAME REALLY,SHAME,negative
814f378242, Trudy`s off Burnet...the one up north that no one goes to,Trudy`s off Burnet...the one up north that no one goes to,neutral
1e4cb0b523, er yea am i doubly awesome now?,am i doubly awesome,positive
b5610e69af,daddy is in the hospital  i dont like it!,i dont like it!,negative
d486b66288,"imissu, come back home now honey","imissu,",negative
29dbb23bed,Two fantastic shows in a row,fantastic,positive
6d873a0b93,Planning to run riot in Luton today! BA HAA!  Not reeeally  where`s the library in this (****) town though?,Planning to run riot in Luton today! BA HAA!  Not reeeally  where`s the library in this (****) town though?,neutral
22fa0e467e,i gots a summer job,i gots a summer job,neutral
5fff4f9b99, I`m at work,I`m at work,neutral
3fe5f360ef,_786 It`s no secret I`m an apple boy! Have considered the iphone dark side MANY times,It`s no secret I`m an apple boy! Have considered the iphone dark side MANY times,neutral
fcc45b5d05,_girl - Bummer...mail came but package didn`t,Bummer..,negative
a3b20c9c86," A mocha at 12:30am? My, youre brave",brave,positive
02e569bee0,Dosen`t Want To Go To Work Tomorrow,Dosen`t Want To,negative
fdc3815cee,http://twitpic.com/33hus that`s my baby,http://twitpic.com/33hus that`s my baby,neutral
d3cbc565f8, selena`s mom congratulations` have a nice day,congratulations`,positive
0440e95ebe,"`s going to Disney World, lucky ****.","`s going to Disney World, lucky ****.",positive
66b4c98df6,Shower time,Shower time,neutral
8af4ec0ac0,"3 live p2v migrates, 5 vmware vsp exams, and a magento config, a quiet weekend at party central","3 live p2v migrates, 5 vmware vsp exams, and a magento config, a quiet weekend at party central",neutral
813d073693,instant-messaging with two of my favourite conversation guys,two of my favourite,positive
7a4a97fba9,"The birds are out,, oh man... That`s NOT cool && I didn`t sleep yet for the night!!!",That`s NOT cool,negative
a0a6e32f0f,i am! lol its just i got used 2 talkin 2 ya..!,lol,positive
ce5c7c3e37," Yea, D means direct, so only u and whoever u send it to can see it  But u can only direct msg someone who`s following u..","Yea, D means direct, so only u and whoever u send it to can see it  But u can only direct msg someone who`s following u..",neutral
